{"schemaVersion":1,"artifactType":"gtm-context","generatedAt":"2026-08-19T12:00:00Z","expiresAt":"2026-08-19T12:30:00Z","contextId":"gtm-context-20260819T120000Z-abc123def456","contextSha256":"0000000000000000000000000000000000000000000000000000000000000000","projectRoot":"C:/projects/site","profileId":"profile-test","container":"accounts/1/containers/2","measurementPlan":{"path":"C:/projects/site/measurement.json","planId":"measure-example","contentSha256":"1111111111111111111111111111111111111111111111111111111111111111"},"siteContext":null,"remoteState":{"container":{"path":"accounts/1/containers/2","usageContext":["web"]},"workspaces":[],"liveVersion":{}},"blockers":[],"limitations":["Runtime preview has not been performed."],"networkUsed":true,"mutationPerformed":false}
